{
  "$schema": "http://json-schema.org/draft-07/schema#",
  "title": "Ghoti swarm task spec (N+6.27A)",
  "description": "Input task spec read by 03_scripts/swarm_launcher/ghoti_swarm_launcher.py. The launcher parses this, validates scope, assigns roles, detects file-ownership overlap, and emits a DRY-RUN plan. The launcher never executes anything described here.",
  "type": "object",
  "required": ["title", "tasks"],
  "properties": {
    "milestone": {"type": "string"},
    "title": {"type": "string"},
    "scope": {
      "type": "object",
      "description": "Repo-relative path prefixes the tasks may touch. Files outside these are scope violations. No absolute paths, no drive letters, no '..'.",
      "properties": {
        "allowed_paths": {"type": "array", "items": {"type": "string"}},
        "description": {"type": "string"}
      }
    },
    "constraints": {
      "type": "object",
      "properties": {
        "max_parallel": {"type": "integer", "minimum": 1,
                         "description": "Rolling-pool bound: at most this many tasks per wave."}
      }
    },
    "tasks": {
      "type": "array",
      "minItems": 1,
      "items": {
        "type": "object",
        "required": ["id", "role"],
        "properties": {
          "id": {"type": "string"},
          "role": {"type": "string", "enum": ["planner", "builder", "auditor", "summarizer", "human_approver"]},
          "agent": {"type": "string", "description": "Optional explicit agent id; defaults to the role's agent."},
          "description": {"type": "string"},
          "files": {"type": "array", "items": {"type": "string"},
                    "description": "Repo-relative paths this task owns. One owner per path across all tasks."},
          "depends_on": {"type": "array", "items": {"type": "string"},
                         "description": "Task ids that must complete first; drives the wave order."}
        }
      }
    }
  }
}
